{
  "schemaVersion": 1,
  "generatedFrom": "runtime/ingress-contract.json",
  "limits": {
    "mailboxCapacity": 16,
    "producerCount": 7,
    "rawTickBits": 32,
    "maximumDrainPerPass": 16
  },
  "traces": [
    {
      "id": "tick-rollover-boot",
      "facts": [
        {
          "producer": "STORAGE",
          "epoch": 1,
          "producerSequence": 1,
          "rawTick": 4294967280,
          "type": "CONFIG_READY"
        },
        {
          "producer": "LOCAL_OUTPUT",
          "epoch": 1,
          "producerSequence": 1,
          "rawTick": 4294967281,
          "type": "LOCAL_OUTPUT_AVAILABLE"
        },
        {
          "producer": "WIFI",
          "epoch": 1,
          "producerSequence": 1,
          "rawTick": 4294967282,
          "type": "WIFI_CONNECTED"
        },
        {
          "producer": "RESOLVER",
          "epoch": 1,
          "producerSequence": 1,
          "rawTick": 4294967283,
          "type": "RESOLVER_READY"
        },
        {
          "producer": "STREAM",
          "epoch": 1,
          "producerSequence": 1,
          "rawTick": 5,
          "type": "STREAM_HEALTHY"
        },
        {
          "producer": "BLUETOOTH",
          "epoch": 1,
          "producerSequence": 1,
          "rawTick": 6,
          "type": "BLUETOOTH_REMEMBERED"
        },
        {
          "producer": "BLUETOOTH",
          "epoch": 1,
          "producerSequence": 2,
          "rawTick": 7,
          "type": "BLUETOOTH_CONNECTED"
        }
      ],
      "expected": {
        "finalState": "PLAYING",
        "finalOutput": "BT",
        "acceptedFacts": 7,
        "deliveredFacts": 7,
        "mailboxOverflows": 0,
        "invalidFacts": 0,
        "duplicateFacts": 0,
        "staleFacts": 0,
        "staleEpochs": 0,
        "backwardTicks": 0,
        "rollovers": 1,
        "maximumMailboxDepth": 7,
        "deliveryRejected": 0,
        "runtimeProcessedEvents": 7,
        "stateHash": "e4129a21d63de787"
      }
    },
    {
      "id": "delayed-stream-and-bluetooth-loss",
      "facts": [
        {
          "producer": "STORAGE",
          "epoch": 1,
          "producerSequence": 1,
          "rawTick": 100,
          "type": "CONFIG_READY"
        },
        {
          "producer": "WIFI",
          "epoch": 1,
          "producerSequence": 1,
          "rawTick": 101,
          "type": "WIFI_CONNECTED"
        },
        {
          "producer": "STREAM",
          "epoch": 1,
          "producerSequence": 1,
          "rawTick": 102,
          "type": "STREAM_STALLED"
        },
        {
          "producer": "LOCAL_OUTPUT",
          "epoch": 1,
          "producerSequence": 1,
          "rawTick": 103,
          "type": "LOCAL_OUTPUT_AVAILABLE"
        },
        {
          "producer": "RESOLVER",
          "epoch": 1,
          "producerSequence": 1,
          "rawTick": 104,
          "type": "RESOLVER_READY"
        },
        {
          "producer": "STREAM",
          "epoch": 1,
          "producerSequence": 2,
          "rawTick": 105,
          "type": "STREAM_HEALTHY"
        },
        {
          "producer": "BLUETOOTH",
          "epoch": 1,
          "producerSequence": 1,
          "rawTick": 106,
          "type": "BLUETOOTH_REMEMBERED"
        },
        {
          "producer": "BLUETOOTH",
          "epoch": 1,
          "producerSequence": 2,
          "rawTick": 107,
          "type": "BLUETOOTH_CONNECTED"
        },
        {
          "producer": "BLUETOOTH",
          "epoch": 1,
          "producerSequence": 3,
          "rawTick": 108,
          "type": "BLUETOOTH_LOST"
        }
      ],
      "expected": {
        "finalState": "DEGRADED_PLAYING",
        "finalOutput": "LOCAL",
        "acceptedFacts": 9,
        "deliveredFacts": 9,
        "mailboxOverflows": 0,
        "invalidFacts": 0,
        "duplicateFacts": 0,
        "staleFacts": 0,
        "staleEpochs": 0,
        "backwardTicks": 0,
        "rollovers": 0,
        "maximumMailboxDepth": 9,
        "deliveryRejected": 0,
        "runtimeProcessedEvents": 9,
        "stateHash": "1d71633871368196"
      }
    },
    {
      "id": "producer-epoch-restart",
      "facts": [
        {
          "producer": "STORAGE",
          "epoch": 1,
          "producerSequence": 1,
          "rawTick": 1000,
          "type": "CONFIG_READY"
        },
        {
          "producer": "LOCAL_OUTPUT",
          "epoch": 1,
          "producerSequence": 1,
          "rawTick": 1001,
          "type": "LOCAL_OUTPUT_AVAILABLE"
        },
        {
          "producer": "WIFI",
          "epoch": 1,
          "producerSequence": 1,
          "rawTick": 1002,
          "type": "WIFI_CONNECTED"
        },
        {
          "producer": "RESOLVER",
          "epoch": 1,
          "producerSequence": 1,
          "rawTick": 1003,
          "type": "RESOLVER_READY"
        },
        {
          "producer": "STREAM",
          "epoch": 1,
          "producerSequence": 1,
          "rawTick": 1004,
          "type": "STREAM_HEALTHY"
        },
        {
          "producer": "WIFI",
          "epoch": 2,
          "producerSequence": 1,
          "rawTick": 1005,
          "type": "WIFI_LOST"
        },
        {
          "producer": "WIFI",
          "epoch": 1,
          "producerSequence": 2,
          "rawTick": 1006,
          "type": "WIFI_CONNECTED"
        },
        {
          "producer": "WIFI",
          "epoch": 2,
          "producerSequence": 2,
          "rawTick": 1007,
          "type": "WIFI_CONNECTED"
        },
        {
          "producer": "STREAM",
          "epoch": 1,
          "producerSequence": 2,
          "rawTick": 1008,
          "type": "STREAM_HEALTHY"
        }
      ],
      "expected": {
        "finalState": "PLAYING",
        "finalOutput": "LOCAL",
        "acceptedFacts": 8,
        "deliveredFacts": 8,
        "mailboxOverflows": 0,
        "invalidFacts": 0,
        "duplicateFacts": 0,
        "staleFacts": 0,
        "staleEpochs": 1,
        "backwardTicks": 0,
        "rollovers": 0,
        "maximumMailboxDepth": 8,
        "deliveryRejected": 0,
        "runtimeProcessedEvents": 8,
        "stateHash": "cb14ab0eaf66ce66"
      }
    },
    {
      "id": "mailbox-saturation",
      "facts": [
        {
          "producer": "POWER",
          "epoch": 1,
          "producerSequence": 1,
          "rawTick": 2000,
          "type": "POWER_INTERRUPTED"
        },
        {
          "producer": "POWER",
          "epoch": 1,
          "producerSequence": 2,
          "rawTick": 2000,
          "type": "POWER_INTERRUPTED"
        },
        {
          "producer": "POWER",
          "epoch": 1,
          "producerSequence": 3,
          "rawTick": 2000,
          "type": "POWER_INTERRUPTED"
        },
        {
          "producer": "POWER",
          "epoch": 1,
          "producerSequence": 4,
          "rawTick": 2000,
          "type": "POWER_INTERRUPTED"
        },
        {
          "producer": "POWER",
          "epoch": 1,
          "producerSequence": 5,
          "rawTick": 2000,
          "type": "POWER_INTERRUPTED"
        },
        {
          "producer": "POWER",
          "epoch": 1,
          "producerSequence": 6,
          "rawTick": 2000,
          "type": "POWER_INTERRUPTED"
        },
        {
          "producer": "POWER",
          "epoch": 1,
          "producerSequence": 7,
          "rawTick": 2000,
          "type": "POWER_INTERRUPTED"
        },
        {
          "producer": "POWER",
          "epoch": 1,
          "producerSequence": 8,
          "rawTick": 2000,
          "type": "POWER_INTERRUPTED"
        },
        {
          "producer": "POWER",
          "epoch": 1,
          "producerSequence": 9,
          "rawTick": 2000,
          "type": "POWER_INTERRUPTED"
        },
        {
          "producer": "POWER",
          "epoch": 1,
          "producerSequence": 10,
          "rawTick": 2000,
          "type": "POWER_INTERRUPTED"
        },
        {
          "producer": "POWER",
          "epoch": 1,
          "producerSequence": 11,
          "rawTick": 2000,
          "type": "POWER_INTERRUPTED"
        },
        {
          "producer": "POWER",
          "epoch": 1,
          "producerSequence": 12,
          "rawTick": 2000,
          "type": "POWER_INTERRUPTED"
        },
        {
          "producer": "POWER",
          "epoch": 1,
          "producerSequence": 13,
          "rawTick": 2000,
          "type": "POWER_INTERRUPTED"
        },
        {
          "producer": "POWER",
          "epoch": 1,
          "producerSequence": 14,
          "rawTick": 2000,
          "type": "POWER_INTERRUPTED"
        },
        {
          "producer": "POWER",
          "epoch": 1,
          "producerSequence": 15,
          "rawTick": 2000,
          "type": "POWER_INTERRUPTED"
        },
        {
          "producer": "POWER",
          "epoch": 1,
          "producerSequence": 16,
          "rawTick": 2000,
          "type": "POWER_INTERRUPTED"
        },
        {
          "producer": "POWER",
          "epoch": 1,
          "producerSequence": 17,
          "rawTick": 2000,
          "type": "POWER_INTERRUPTED"
        },
        {
          "producer": "POWER",
          "epoch": 1,
          "producerSequence": 18,
          "rawTick": 2000,
          "type": "POWER_INTERRUPTED"
        }
      ],
      "expected": {
        "finalState": "CONFIG_REQUIRED",
        "finalOutput": "LOCAL",
        "acceptedFacts": 16,
        "deliveredFacts": 16,
        "mailboxOverflows": 2,
        "invalidFacts": 0,
        "duplicateFacts": 0,
        "staleFacts": 0,
        "staleEpochs": 0,
        "backwardTicks": 0,
        "rollovers": 0,
        "maximumMailboxDepth": 16,
        "deliveryRejected": 0,
        "runtimeProcessedEvents": 16,
        "stateHash": "83593ebd993ef7e7"
      }
    },
    {
      "id": "backward-callback-tick",
      "facts": [
        {
          "producer": "STORAGE",